MovieId,Title,Genre,Description
101,"AI Adventures","Sci-Fi","A futuristic tale of robots and humans coexisting."
102,"Cooking with Love","Romance","A charming story of a chef discovering love in the kitchen."
103,"Space War","Sci-Fi","Intergalactic battles and heroic missions in deep space."
104,"Comedy Night","Comedy","A stand-up comedian tries to find meaning in everyday life."
105,"Love in Paris","Romance","A couple explores the city of light, finding romance at every corner."
106,"Alien Encounter","Sci-Fi","Humans make first contact with an alien species."
107,"Laugh Out Loud","Comedy","A series of hilarious mishaps in a small town."